{
  "function_calls": [
    {
      "call": "eval",
      "score": 42,
      "tags": ["eval_tag"]
    }
  ],
  "sensitive_filenames": [
    "my_passwords.txt"
  ],
  "modules": [

  ],
  "taint_sinks": [
    "flask.make_response"
  ],
  "taint_sources": [
    "flask.request.args.*",
    "flask.request.form.*",
    "flask.request.path",
    "flask.request.headers.*",
    "flask.request.files.*",
    "flask.request.cookies.*"
  ]
}
